#,Fertilizer Name,Category,Nutrient,Application Timing,Form,Effect on Mestiso 20 (M20)
1,Urea (46-0-0),Solid,Nitrogen,Basal + Top-dress,Solid,Promotes vigorous vegetative growth; top-dress at active tillering (21 DAT) and PI for max yield.
2,Complete (14-14-14),Solid,NPK,Basal,Solid,Ensures all macro-nutrients available from day 1; supports high early growth rate in hybrid.
3,Ammonium Sulfate (21-0-0),Solid,Nitrogen + Sulfur,Top-dress,Solid,Sulfur component boosts amino acid synthesis; improves grain protein profile and milling quality.
4,Muriate of Potash (0-0-60),Solid,Potassium,Top-dress at PI,Solid,Enhances panicle weight and filled grain percentage; improves grain plumpness at maturity.
#,Fertilizer Name,Category,Nutrient,Application Timing,Form,Effect on Mestiso 20 (M20)
5,Biofertilizer (Liquid Concentrate),Liquid,Biostimulant,Foliar / Soil drench,Liquid,Triacontanol stimulates photosynthetic rate; iron and zinc micronutrients support chlorophyll synthesis and leaf greenness in high-yield hybrid.
6,Nanobiofertilizer,Liquid,Nano NPK + Bio,Foliar spray,Liquid,Humic and fulvic acids improve nutrient chelation; sea kelp extract promotes cell division and panicle initiation in hybrid.
7,Organic Root Exudate Mix,Liquid,Organic-Bio,Soil drench,Liquid,Organic acids in mix lower localized soil pH around roots; improves micronutrient availability in alkaline paddy soils.
8,Azolla microphylla,Liquid,Bio-N Fixer,Incorporate / Flood,Liquid,Azolla decomposition improves soil organic matter; released N supports high-yield hybrid's tillering stage without leaching risk.
9,Foliar Liquid Fertilizer (NPK),Liquid,NPK Foliar,Foliar spray at critical stages,Liquid,Foliar NPK at heading stage improves grain set percentage; rapid leaf absorption bypasses soil nutrient fixation issues.